{
  "device_id": "22222222-2222-4222-8222-222222222222",
  "schema_version": "1.0",
  "first_seen_at": "2026-01-01T00:05:00Z",
  "last_seen_at": "2026-01-15T09:00:00Z",
  "device_type": "MOBILE",
  "operating_system": "IOS",
  "is_trusted": true,
  "device_country": "US",
  "primary_account_id": "11111111-1111-4111-8111-111111111111"
}
